Hier voren light begrauen, die noch in leuen is,
Pietre Carbonier: wiens lichaem dat ghegeuen is
(Deur Atropos rigeur) der aerden vander kercken:
Maer deur mi in onsterflickheit hy verheuen is
Als een peerle onder alle Gods wonder wercken.
Want in zinen tijd was hi een man (maghmen mercken
An tzuchten van velen) die elcken assisteerde
Med zijn gauen. En was milde tot leeck en clercken:
Excellent ingien, in tghuent dat hi componeerde:
Natuerlic Poet, oock die elcken recreerde
Med zijn bequaemheit dies elc zocht zijn presentie.
Somma meest alle ingienen hi verre passeerde:
Maer meer vter natueren, dan deur scientie.
Hi hadde inde memori' zulcke excellencie
Dat hijt al onthielt, wtghenomen t'onghelijc
Datmen hem dede, dies hi in preminencie
Med rechten verheuen was. Och! nu is hi slijc
Spijse der wormen, tot dat de ziel publijc
Med d'lichaem zal in onsterflicheit versamen
Deur Gods graci': die ons daer al bringhe Amen.