De Wijsheit, trots op haer rechtvaerdigh wapen,
Niet uit het brein geklonken van Jupijn,
Maer uit het hooft van Fidias Quellijn,
Vertoont zich hier door geest en kunst herschapen.
Zy hoeft geensins te zwichten voor aelouwen,
Schoon Grieken roemt op zijn beelthouwers hant,
En eeuwen lang de kroon der godthe'ean spant,
Uit marmersteen, de Nijt ten trots, gehouwen.
De kunsten staen aen eeu noch tijt gebonden.
Vernuften gaen en komen op hunn' tijt.
Het voor of na brengt lof aen, noch verwijt.
De jongste vint wel dat geene outsten vonden.
Natuur bestelt alle eeuwen elk haer voorbeelt.
Vernuft bootseert haer hant en omtrek na.
Men schat de kunst, die hangt aen vroegh noch spa.
Het werkstuk wort naer 't wezen zelf geoordeelt.
Der beelden vondt is ouder dan de Grieken:
Al wort de Griek onsterfelijk geacht,
Naerdien hy 't beelt in top van eere bragt,
Gelijk de Faem dit omvoert met haer wieken.
Men gunn' deze eer aen Pallasstadt Athenen,
Die zoo veel Go'f4n en helden heeft gebaert,
Welx overschot noch heiligh, noch bewaert,
Schoon 't misgebruik der beelden is verdweenen:
Maer Pallasstadt gehenge dat wy mede
Braveeren met dit wonder heilighdom.
Het wezen spreekt, al staen de lippen stom.
Al zwijght de mont, zy leert met haere zede.
MAURITIUS, noit vast aen 't juk der vrouwen,
Wert noch belust in zijnen ouden dagh,
Zoo dra de helt de wijze Pallas zagh,
Haer rechte hant uit rechte min te trouwen.
Ons raethuis helpt dit huwelijk voltrekken,
En voert den Vorst de heldenwijsheit t'huis,
Met Aemstels schilt, het heerlijk wapenkruis,
Om tot cieraet van 's Vorsten bron te strekken:
Daer buiten Kleef hy zoo veel levende aderen
Ten bergh uit lokt, het eeuwigh leven teelt,
En onder aen de voeten van het beelt
De sprongen in een' boezem rijk vergaderen.
Narcis zal op zich zelven hier verlieven,
Bespiegelen den schoonen wederschijn,
Verscheenen in het spiegelkristalijn.
De bron zal hem met waterstraelen grieven.
Nu lustme naer geen Hengstebron te rennen,
Daer Helikon de Grieksche dichters drenkt,
Nu Mauritsbron my zulk een' toevloet schenkt,
Waerna de zwaen komt streven met haer pennen.
De vier dolfijns ontfangen 't zuiver water,
En loozen 't we'ear ter keele schuimende uit.
Ik stel hier op de snaren van mijn luit,
En huw mijn' toon aen 't liefelijk geklater.
De we'eargalm schept vermaek my na te baeuwen,
Daer ik den lof van grooten MAURITS speel.
Dan volght een rey van galmen mijne keel,
Die in het oor allengs allengs verflaeuwen.
Laet elk dien bergh voortaen den Zangbergh noemen,
Daer Pallas niet by wijlen zich vertoont,
Maer eeuwigh by de Kunstgodinnen woont,
In eene lucht, vol geurs van kruit en bloemen.
Apollo, die zijn hair vlecht met laurieren,
Wil hier den dans beleiden van zijn koor,
En danssen zelf de zanggodessen voor,
Belust met haer het brongety te vieren.
De Keurvorst komt, vermoeit van oorelogen,
Hier rusten in een' aengenamen pais,
En by dees spring vergeeten 't keurpallais,
Het hofgewelf, ten hemel opgetogen.
Ulysses list, noch Diomedes wapen,
Die 't heilighdom van Troje randen aen,
Ontzien hun hant aen dees Godin te slaen,
Zoo braef is haer een godtheit ingeschapen.
Dat FREDERIK en zijn Stadthouder leven,
En groeien in naemhaftigheit en eer,
Zoo lang dees maeght de wacht houdt met haer speer,
En langer dan haer bron zal water geven.